{
  "$schema": "https://json-schema.org/draft/2020-12/schema",
  "$id": "https://trustweave.dev/schemas/bundle/v1alpha1",
  "title": "TrustWeave Agent Security Bundle v1alpha1",
  "type": "object",
  "required": ["schema_version", "manifest", "policy", "findings", "summary", "limits"],
  "properties": {
    "schema_version": {"const": "trustweave.dev/bundle/v1alpha1"},
    "manifest": {"type": "object"},
    "policy": {"type": "object"},
    "findings": {"type": "array", "maxItems": 10000, "items": {"type": "object"}},
    "summary": {
      "type": "object",
      "required": ["allow", "deny", "require_approval"],
      "properties": {
        "allow": {"type": "integer", "minimum": 0},
        "deny": {"type": "integer", "minimum": 0},
        "require_approval": {"type": "integer", "minimum": 0}
      },
      "additionalProperties": false
    },
    "limits": {
      "type": "array",
      "minItems": 1,
      "maxItems": 32,
      "items": {"type": "string", "minLength": 1, "maxLength": 4096}
    },
    "generated_at": {"type": "string", "format": "date-time"}
  },
  "additionalProperties": false
}
